{
  "control_id": "complaint-deny-prevents-serving",
  "control_type": "DENY_PREVENTS_TARGET_EFFECT",
  "control_version": "1",
  "coverage_requirement": {
    "post_decision_seconds": "5",
    "rule_version": "deny-target-coverage/1"
  },
  "governance_condition": {
    "decision": "DENY"
  },
  "observation_boundary": "TARGET_REPORTED_REPRESENTATION_SERVING",
  "prohibited_target_effect": {
    "name": "REPRESENTATION_SERVED",
    "target_contract_digest": "sha256:780ea70f9fd41889af80634d905d13aa3795ea186d6d12a753513661ed3ac304",
    "target_id": "complaints-static-v1"
  },
  "schema_version": "1.0",
  "scope": {
    "action": "read",
    "resource_type": "employee_complaint"
  }
}
